{
  "source_name": "malwarebazaar",
  "source_type": "external_feed",
  "location": {
    "local_path": "ai/datasets/raw/malwarebazaar/",
    "remote_reference": {
      "uri": "https://<provider-endpoint-or-export>/malwarebazaar",
      "format_hint": "csv_or_json",
      "retrieval_hint": "connector_deferred_phase0"
    }
  },
  "access_notes": [
    "Do not automate retrieval until connector and handling controls are approved.",
    "Planned raw staging path: ai/datasets/raw/malwarebazaar/."
  ],
  "ingestion_mode": "deferred_remote_import",
  "parser_name": "malwarebazaar_feed_parser_v1",
  "normalization_target": "observable_enrichment_v1",
  "provenance_fields": [
    "source",
    "key",
    "value",
    "evidence_id",
    "citation_ref",
    "retrieved_at_utc",
    "retrieved_by",
    "record_locator"
  ],
  "enabled": false
}
