{
  "source_name": "urlhaus",
  "source_type": "external_feed",
  "location": {
    "local_path": "ai/datasets/raw/urlhaus/",
    "remote_reference": {
      "uri": "https://<provider-endpoint-or-export>/urlhaus",
      "format_hint": "csv_or_json",
      "retrieval_hint": "connector_deferred_phase0"
    }
  },
  "access_notes": [
    "Manual local staging only in Phase 1. Do not automate retrieval until connector and handling controls are approved.",
    "Expected raw staging path: ai/datasets/raw/urlhaus/.",
    "Preserve provider provenance fields and URL/payload references exactly as staged."
  ],
  "ingestion_mode": "deferred_remote_import",
  "parser_name": "urlhaus_feed_parser_v1",
  "normalization_target": "observable_enrichment_v1",
  "provenance_fields": [
    "source",
    "key",
    "value",
    "evidence_id",
    "citation_ref",
    "retrieved_at_utc",
    "retrieved_by",
    "record_locator"
  ],
  "enabled": true
}
