{
  "source_name": "threatfox",
  "source_type": "external_feed",
  "location": {
    "remote_reference": {
      "uri": "https://<provider-endpoint-or-export>/threatfox",
      "format_hint": "csv_or_json",
      "retrieval_hint": "connector_deferred_phase0"
    }
  },
  "access_notes": [
    "Use approved access channel only after policy and legal review.",
    "Planned raw staging path: ai/datasets/raw/threatfox/."
  ],
  "ingestion_mode": "deferred_remote_import",
  "parser_name": "threatfox_feed_parser_v1",
  "normalization_target": "observable_enrichment_v1",
  "provenance_fields": [
    "source",
    "key",
    "value",
    "evidence_id",
    "citation_ref",
    "retrieved_at_utc",
    "retrieved_by",
    "record_locator"
  ],
  "enabled": false
}
